created_at,tweet,Категорія,Категорія_Ід
14.06.2021 21:53:55,"Вітаю розуміння партнерами з країн @NATO всіх ризиків і викликів, з якими ми маємо справу. Лідери НАТО підтвердили, що 🇺🇦 стане членом Альянсу, а #ПДЧ є невід’ємною складовою процесу набуття членства. 🇺🇦 заслуговує на належну оцінку її ролі у забезпеченні євроатлантичної безпеки.",Підтримка,6
14.06.2021 15:44:52,"Дякую @SenatorMenendez за принципову позицію щодо російської агресії та підтримку України. Ми боремося за спільні цінності. Згоден, що «Північний потік – 2» має бути зупинений, а Україна – інтегрована в НАТО. Очікую на нашу зустріч у Вашингтоні.",Вдячність,3
14.06.2021 13:39:12,"Перед самітом @NATO у телефонній розмові з @BorisJohnson наголосив на важливості чіткої перспективи членства для #України. Ми проводимо реформи в умовах зовнішньої агресії. Час, щоб партнери по #НАТО підтримали 🇺🇦 конкретними рішеннями. Також обговорили співпрацю у сфері оборони.  https://t.co/kh10v6mzp0",Подія,5
14.06.2021 11:07:22,"14 червня 2014 року в небі неподалік Луганська було збито Іл-76 Повітряних сил ЗСУ. Ми втратили 40 десантників і 9 членів екіпажу. Маємо робити все, щоб ці хлопці, дивлячись на нас згори, знали – вони пожертвували своїми життями не марно. Вічна пам’ять!  https://t.co/hOSJtv31k4",Співчуття,2
14.06.2021 10:19:17,"Пішов з життя Григорій Миколайович Чапкіс. Великий танцівник, людина, особистість. З незламним характером, з сильною енергетикою, з неповторним «рухом на паркеті». Невиправний оптиміст, той, з кого хотілося брати приклад. Для кого танець був його життям.  Назавжди в моєму серці!  https://t.co/fgJlSsAZfV",Співчуття,2
14.06.2021 00:16:07,"Емоційний початок. Дуже сильна гра. Хлопці дійсно боролися до останньої секунди. Кожен українець був з Вами сьогодні і буде й далі. А далі – важливі дві гри і ПЕРЕМОГА! Бо те, що у Вас написано на формі, не затерти й не прибрати! Бо це – про Україну! Бо це сьогодні – про Вас.  https://t.co/Sp7w2k75iG",Підтримка,6
13.06.2021 23:49:00,"Вітаю @naftalibennett з призначенням на посаду Прем'єр-міністра Держави #Ізраїль @IsraeliPM. Україна завжди відчувала підтримку Ізраїлю. Сподіваюся, наше двостороннє партнерство буде зміцнюватися в ім'я процвітання наших народів.",Вшанування,7
13.06.2021 21:44:34,"Вітаю непохитну підтримку #України державами #G7 у комюніке Саміту. Вдячний лідерам 🇬🇧 🇩🇪 🇨🇦 🇮🇹 🇺🇸 🇫🇷 🇯🇵 🇪🇺 за незмінну підтримку незалежності, суверенітету й територіальної цілісності 🇺🇦 та заклик до агресора відвести війська від кордонів 🇺🇦 і з Криму. #Крим – це Україна!",Вшанування,7
12.06.2021 09:00:18,"Щирі вітання Її Величності #queenelizabeth2nd, королівській родині @RoyalFamily та народу 🇬🇧 з нагоди офіційного дня народження #Королеви. Бажаємо міцного здоров’я, натхнення, миру, гармонії й процвітання. Нехай стратегічне партнерство 🇺🇦 та 🇬🇧 буде на користь нашим народам.",Вшанування,7
11.06.2021 22:00:12,Важливі новини від наших 🇺🇸 партнерів. @DeptofDefense затвердив другу частину безпекової допомоги 🇺🇦 у 2021 році на $150 млн. Вдячний @WhiteHouse за надзвичайно важливий внесок у зміцнення обороноспроможності армії 🇺🇦 та збереження життів наших вояків.,Вдячність,3
11.06.2021 19:35:44,У телефонній розмові з #МеттеФредеріксен @Statsmin розповів про безпекову ситуацію на Донбасі та скупчення російських військ біля кордонів 🇺🇦. Обговорили підтримку зусиль України щодо членства в #НАТО. Подякував 🇩🇰 за рішення надати 🇺🇦 500 тис. доз вакцини проти #COVID19.,Вдячність,3
10.06.2021 19:47:41,"Поінформував @jensstoltenberg про суттєві загрози з боку РФ. Сподіваюся, на саміті @NATO будуть розглянуті дієві кроки зі стримування агресії 🇷🇺. Наголосив на важливості для #України підтвердження політики відкритих дверей Альянсу та чинності рішення від 2008 р. щодо #ПДЧ для 🇺🇦.  https://t.co/Jpg3vXN6x9",Сентенція,4
10.06.2021 17:17:32,"Мав змістовну розмову з @luigidimaio. Відносини між 🇺🇦 та 🇮🇹 втілюються в економічні угоди й міцні міжлюдські зв’язки. Наголосив на важливості для 🇺🇦 отримання #ПДЧ в @NATO, сподіваюся на підтримку 🇮🇹 євроінтеграційних зусиль 🇺🇦. Очікую на участь 🇮🇹 у саміті #КримськоїПлатформи.  https://t.co/ehnbG79J96",Подія,5
10.06.2021 12:45:59,"Вітаю народ 🇵🇹 з Днем Португалії, Камоеша та Португальських громад. Вдячний за підтримку територіальної цілісності #України, наших європейських і євроатлантичних прагнень. Радо вітатиму @presidencia на саміті #КримськоїПлатформи та святкуванні 30-річчя незалежності 🇺🇦.  https://t.co/SLh5E7YZaM",Вшанування,7
09.06.2021 17:01:48,"Знову на #Донбасі. Знову – на передовій. Дуже важливо почути з перших вуст про ситуацію на лінії фронту й розповісти нашим захисникам, що ми робимо для встановлення миру. Бачу в наших бійців повне розуміння ситуації, спокій і впевненість. На таких патріотах тримається оборона 🇺🇦.  https://t.co/NvRJ7AlPzQ",Підтримка,6
09.06.2021 09:26:21,Мав продуктивну бесіду з @JustinTrudeau. Обговорили ситуацію на #Донбасі та збереження тиску на РФ для досягнення миру. Вдячний 🇨🇦 за підтримку суверенітету та євроатлантичних прагнень 🇺🇦. Скоординували позиції щодо розслідування катастрофи літака #рейсуPS752  https://t.co/kZCMCdQ1On,Подія,5
07.06.2021 20:25:11,"Дякую @POTUS @JoeBiden за запрошення під час нашої телефонної розмови відвідати Білий дім @WhiteHouse у липні цього року. Дуже очікую на зустріч, щоб обговорити шляхи розширення стратегічної співпраці України та #США",Сентенція,4
07.06.2021 16:55:49,"Дякую @giannibuquicch1 за постійну підтримку України в розбудові антикорупційної системи та проведенні судової реформи. Під час зустрічі відзначив допомогу @VeniceComm у врегулюванні кризи навколо Конституційного Суду, якому треба повернути роль неупередженого арбітра в державі.  https://t.co/mnuQZbRrUF",Вдячність,3
07.06.2021 16:23:58,"У своїй передвиборчій програмі я задекларував мету: не боротьба з корупцією, а перемога над нею. Вперше ми говоримо не лише про протидію корупції, а й про викоренення однієї з її базових причин – впливу олігархів на політиків і держслужбовців.  https://t.co/aCMOPOSSFv",Невдоволення,1
07.06.2021 16:22:44,"Вважаю, Верховна Рада має якнайшвидше ухвалити внесений урядом проект «Про засади державної антикорупційної політики на 2020-2024 роки» й затвердити Антикорупційну стратегію. Одним з її принципів має бути суспільна нетерпимість до корупції та утвердження культури доброчесності.  https://t.co/8VWbtOXzWA",Невдоволення,1
07.06.2021 16:21:56,Кримінальна відповідальність за неподання декларації або внесення завідомо недостовірних відомостей має бути суворою й передбачати покарання у вигляді позбавлення волі. Корупціонери повинні понести відповідальність згідно із законом.  https://t.co/xYcVOLGkRA,Невдоволення,1
07.06.2021 16:20:47,"На 30-му році незалежності нам досі доводиться говорити про боротьбу з корупцією в Україні. Вже запрацювала система антикорупційних органів, аналогів якої не існує у світі. Та, на жаль, у суспільстві ще остаточно не сформоване стійке несприйняття корупції на всіх рівнях.  https://t.co/3EiwWt1Lmd",Невдоволення,1
07.06.2021 12:03:07,"Ми розпочинаємо проект «Зелена країна», що має амбітну, але, я впевнений, досяжну мету – за 10 років збільшити площі лісів на 1 млн га. Задля цього в найближчі три роки ми прагнемо висадити в Україні 1 млрд дерев. Відповідний указ про старт програми я підписую сьогодні.  https://t.co/kmLlJn12bg",Підтримка,6
07.06.2021 12:02:22,"Ми запроваджуємо нові правила продажу деревини, які ліквідують «сірий» ринок. У країні прозоро, онлайн і без корупційних ризиків має реалізовуватися 100% необробленої деревини. Перші кроки вже дали свої результати – це +1 млрд доходів державних лісгоспів лише за І квартал року.  https://t.co/PPkwprCNXP",Підтримка,6
07.06.2021 12:01:30,"З моєї ініціативи розпочато процес ревіталізації зони відчуження, що передбачає зміни в інфраструктурі, нову концепцію розвитку території, внутрішню та міжнародну промоцію Чорнобиля. Він має стати магнітом для туристів з усього світу, а зона відчуження – зоною відродження.  https://t.co/1LPMj36iga",Підтримка,6
07.06.2021 12:00:43,"Колись на нараді з правоохоронцями я казав: усі, хто не хоче для України чистого повітря, чистого неба, мають бачити це небо в клітинку. І наші промисловці мають розуміти, що у ХХІ столітті замало бути успішними й продуктивними, потрібно бути відповідальними.  https://t.co/YFrO6sxlDl",Невдоволення,1
07.06.2021 11:59:46,"Ми робимо все, щоб надра працювали на майбутні покоління, серед іншого – були основою для запровадження економічного паспорта українця, коли кожна дитина отримуватиме відсоток від видобутку копалин та зможе використати ці кошти на навчання в Україні.  https://t.co/D5QhY08CCr",Сентенція,4
06.06.2021 09:54:33,"Гострі, нетерплячі, дотепні, оперативні, професійні, з посиленим відчуттям справедливості – такі українські журналісти. Та передусім це люди, які мріють і прагнуть змін. І головна мрія, яка об'єднує і журналістів, і Президента, – зробити Україну кращою. Нехай вона здійсниться!  https://t.co/9zLR2TpxHL",Вшанування,7
06.06.2021 08:58:23,"Від імені українського народу вітаю народ Швеції з Національним днем. Наші країни об'єднують не лише міцні історичні зв’язки, а й спільні цінності. 🇺🇦 відчуває підтримку 🇸🇪 як у захисті свого суверенітету, так і в євроінтеграційних прагненнях. Бажаю народу Швеції процвітання!",Вшанування,7
05.06.2021 10:15:29,"Вітаю Королеву #Маргрете II і народ Данії з Днем Конституції. Дружні відносини між нашими країнами засновані на спільних цінностях, взаємній повазі, відкритості й солідарності. Ціную вашу підтримку та практичну допомогу 🇺🇦. Бажаю народу 🇩🇰 добробуту та процвітання.",Вшанування,7
04.06.2021 21:06:36,"Серед основних питань, які розглядалися сьогодні на засіданні РНБО: результати боротьби зі злодіями в законі, аудит усіх державних земель і будинків у Конча-Заспі та Пущі-Водиці. І найголовніше питання і цього засідання, і цього тижня – закон про олігархів. https://t.co/74AffYNEQz",Невдоволення,1
03.06.2021 20:04:23,"Вдячний за рішення @POTUS @JoeBiden щодо додаткових поставок Україні вакцини від #COVID19. Стратегічне партнерство 🇺🇦 і 🇺🇸 пізнається у вирішенні саме таких глобальних викликів. Вірю, що підтримуючи й допомагаючи один одному зможемо нарешті побороти пандемію.",Вдячність,3
03.06.2021 13:46:26,"Спільно з урядом та парламентом ми ініціюватимемо законопроекти щодо оптимізації дохідної частини місцевих бюджетів, зокрема щодо вдосконалення плати за землю, податку на нерухоме майно, доходи фізичних осіб, єдиного і транспортного податків.  https://t.co/rQJrDTxf8P",Сентенція,4
03.06.2021 13:46:02,"Реформа місцевого самоврядування лише почалася. Попереду – масштабна робота на субрегіональному та регіональному рівнях, складний процес змін до Конституції щодо адміністративно-територіального устрою, змін до законодавства про місцеве самоврядування та Бюджетного кодексу.  https://t.co/eoFf91Raek",Сентенція,4
02.06.2021 20:33:45,"Обговорив телефоном із @sebastiankurz співпрацю 🇺🇦 і 🇦🇹, зокрема спільні інвестиційні проекти. Проінформував про безпекову ситуацію на #Донбасі. Обмінялися думками щодо перебігу вакцинації та підтримки євроінтеграційних прагнень 🇺🇦. Запросив пана Курца відвідати Україну.",Подія,5
02.06.2021 18:43:09,"Докладно розповів сенаторам @USSenate про підготовку законопроекту, який має усунути вплив олігархів на управління державою. Конгресмени висловили зацікавленість, адже Україна буде першопрохідцем в антиолігархічному законодавстві.  https://t.co/hw74TBZ0TY",Подія,5
02.06.2021 18:28:46,"На зустрічі з членами @USSenate детально обговорили, що армія 🇺🇦 сьогодні захищає #Європу від Росії. Ми також створили Центр протидії російській дезінформації. Україна чи не найкраще знає, як протистояти гібридній агресії РФ, і готова про це розповідати.  https://t.co/K3wyg3aiRs",Подія,5
02.06.2021 18:14:23,"Сенатори @USSenate усвідомлюють: якщо 🇺🇦 не отримає чіткого сигналу щодо ПДЧ в #NATO з розумінням термінів, це стане ще одним чинником для зміцнення геополітичного впливу Росії на Європу після  #ПівнічногоПотоку2.  https://t.co/dbXDVIlakK",Сентенція,4
02.06.2021 18:01:16,"Детально проінформував членів @USSenate, що Україна має важливі аргументи, які готова надати 🇺🇸, щоб зустріч @POTUS @JoeBiden з Президентом Путіним була змістовною та результативною. Це буде потужним підґрунтям для #США на цій зустрічі.  https://t.co/2WO3Dlb8Ub",Подія,5
02.06.2021 17:46:36,"Зупинити добудову #NordStream2 здатні лише 🇺🇸 і @POTUS. Це – потужна зброя, яку дають Росії до рук. Запуск цього газопроводу позбавить Україну коштів, необхідних для зміцнення армії, яка сьогодні захищає всю Європу. Наголосив на цьому в діалозі з сенаторами @USSenate.  https://t.co/ac5g8Ej9ic",Невдоволення,1
02.06.2021 17:32:22,"Детально обговорили з сенаторами @USSenate безпекову ситуацію на #Донбасі й концентрацію сил РФ на окупованих територіях і біля кордону 🇺🇦. З відеовключення із зони проведення ООС вони могли з перших вуст почути про ситуацію на лінії дотику, щоб бути з нами в одному інфополі.  https://t.co/Dpa2IavmiP",Подія,5
02.06.2021 10:28:01,"Щиро вітаю наших італійських друзів з Днем Республіки! Високо цінуємо партнерські взаємини з #Італією та міцні дружні зв'язки, що поєднують наші народи. Готові й надалі тісно працювати разом з @Quirinale і @Palazzo_Chigi для розвитку 🇺🇦🇮🇹 співробітництва.  https://t.co/ZSDVJ0OCM9",Вшанування,7
01.06.2021 10:45:34,"Все, що ми робимо, – робимо заради #дітей. Бо вони – продовження кожного з нас, майбутнє України. Батьківська безумовна любов, прийняття і захист допомагають малечі розкрити свій потенціал і стати успішними дорослими. А щасливі громадяни творять щасливу, успішну та мирну країну.  https://t.co/2FSmZgPKy9",Вшанування,7
31.05.2021 11:57:11,"В Україні буде створено Президентський університет. Там безкоштовно навчатимуть спеціалістів у галузях інформаційної та кібербезпеки, штучного інтелекту, нанотехнологій, аерокосмічних, енергетичних і біотехнологій. Наша мета – це найкращі умови, викладачі та учні.  https://t.co/XtKKZukLXh",Підтримка,6
31.05.2021 11:56:17,"Цього року ми підвищили заробітні плати для наших освітян, але зупинятися на цьому не можна. Ми повинні знаходити нові механізми та кошти для того, щоб вони відчували престижність своєї професії, а молоде покоління хотіло працювати в закладах освіти.  https://t.co/8c5Yv8MY16",Сентенція,4
31.05.2021 11:55:12,"Починаючи з 2019 року, у межах програми «Велике будівництво» ми зробили понад 150 шкіл та понад 100 садочків по всій країні, а до кінця року в планах – збільшити цю кількість до понад двохсот.  https://t.co/RrWKDJK3Sm",Сентенція,4
31.05.2021 11:53:51,"Країна, яка прагне бути конкурентоспроможною в сучасному світі, має визначити освіту та науку своїми стратегічними галузями. Адже розвиток демократичного, успішного, активного суспільства неможливий без освічених, ерудованих, креативних громадян.  https://t.co/IioAXn8STb",Сентенція,4
30.05.2021 11:23:03,"Найважче підбирати слова для найрідніших. Бо всі вони здаються недостатньо виразними, щоб описати твої почуття. Тому просто: з Днем міста, друже #КривийРіг. Місто, де я народився, де живуть мої батьки. Місто, яке подарувало мені кохану та друзів. Місто шахт, металургії та гумору.  https://t.co/GiKR4kZXkZ",Вшанування,7
