created_at,tweet,Категорія,Категорія_Ід
14.07.2020 20:00:40,"Повідомив @KGeorgieva, що до кінця тижня запропоную парламенту кандидатуру нового голови НБУ. Це буде незалежний технократ, який продовжуватиме незалежний курс Нацбанку. Всі рішення я ухвалюю тільки в інтересах народу України.",Сентенція,4
14.07.2020 15:11:23,"Вдячний @AndrejPlenkovic за розуміння необхідності переглянути умови для українських туристів, запроваджені у зв’язку з #COVID19. Hvala lijepa! Хорватія стала одним з туристичних «магнітів» для наших громадян.",Вдячність,3
14.07.2020 13:18:12,"Вітаю @AndrejPlenkovic з переконливою перемогою на виборах. Погодилися, що важливо забезпечити регулярну роботу Спільної українсько-хорватської комісії з питань економічного співробітництва та провести її друге засідання в Києві. Буду радий вітати Прем’єр-міністра в Україні.",Підтримка,6
13.07.2020 09:50:29,Щиро вітаю пана Президента @AndrzejDuda з перемогою на виборах! Бажаю Польщі під Вашим керівництвом подальших успіхів і процвітання. Запрошую Вас відвідати Україну з візитом для продовження нашої плідної співпраці. Разом ми сильніші!  https://t.co/L1SRH5LazA,Підтримка,6
10.07.2020 16:44:13,"Зустрівся з міністром оборони нашого стратегічного партнера – Туреччини @tchulusiakar. Вдячний Турецькій Республіці та @RTErdogan за підтримку суверенітету України, допомогу в протидії #COVID19 та подоланні наслідків повеней. Між 🇺🇦 та 🇹🇷 дуже добрий політичний діалог.  https://t.co/0u0BzitQPe",Подія,5
09.07.2020 13:40:03,"Схоже? Позаду мене – в’їзна вежа Луцького замку, та сама, що на нашій 200-гривневій купюрі. Завжди мріяв порівняти малюнок з реальністю. У замку відчув дух історії та волинських легенд.  #МандруйУкраїною  https://t.co/Qcza6jKfms",Сентенція,4
08.07.2020 21:02:27,"Побував у серці Буковини – Університеті ім. Юрія Федьковича, центрі багатої історії та сучасної освіти. Місцеві кажуть: внутрішній туризм дієвий в об’єднанні українців. Згоден: Україна красива своїми місцями та людьми в кожному куточку! І це те, що нас єднає! #МандруйУкраїною  https://t.co/uO5wAyNxZa",Подія,5
08.07.2020 17:02:59,"Необхідну допомогу отримають всі люди, всі населені пункти, які постраждали внаслідок повеней на заході України, а також ті, що постраждали від лісової пожежі в Луганській області. Сьогодні побував і на сході, й на заході. Триматиму все під контролем.  https://t.co/jg8zFyryX0",Підтримка,6
07.07.2020 20:57:00,Бажаю якнайшвидшого одужання Президенту Бразилії @jairbolsonaro та бразильцям з діагнозом #COVID19. Україна підтримує Бразилію в боротьбі з масштабними наслідками пандемії.  https://t.co/Qli6cBfDI8,Підтримка,6
07.07.2020 15:17:13,"Нагородами держава показує людям, що їхня робота важлива, помітна, цінна. Ми відзначаємо представників медицини, безпеки та оборони, правопорядку, освіти, культури, спорту, журналістики. Дякую кожному за все, що ви робите для нашої країни.  https://t.co/pRhqwtEaNq",Вдячність,3
06.07.2020 20:27:48,"Сьогодні святкує 80-річчя Нурсултан #Назарбаєв. Бажаю з легкістю долати всі виклики – відомі й нові! Міцного здоров'я! З нашої зустрічі зрозумів, що найбільше благо в житті – це мудрість. Туған күніңмен!  https://t.co/Egdu3XQqoC",Вшанування,7
05.07.2020 12:04:56,"Вражений побаченим і почутим у портах великої Одеси: це найперспективніша галузь для інвестування, у ній працюють 100 тис. осіб. Українські порти показують зростання вантажообігу, ми дали старт концесії та залучаємо інвестиції. Україна – морська держава!  https://t.co/MSPoRa2nln",Сентенція,4
05.07.2020 10:27:13,"Сьогодні в містах Краматорськ і Слов’янськ гордо майорить синьо-жовтий прапор. І це дає мені потужний заряд сили та віри в те, що ми обов'язково повернемо всіх наших людей. Повернемо всі наші території. Ми повернемо мирну, єдину й неподільну, могутню та непереможну Україну!  https://t.co/MA2SlIisth",Сентенція,4
05.07.2020 10:24:55,"Сьогодні наші моряки отримають понад 70 квартир. Зокрема, це моряки з Криму, які у 2014 році не зрадили Україні. Нашим першочерговим завданням є гідне матеріальне та соціальне забезпечення українських моряків та їхніх сімей. Ви – справжні супергерої, які дуже потрібні 🇺🇦  https://t.co/g6SNiOiH9b",Вдячність,3
05.07.2020 10:23:26,"Наша державна мета – системно нарощувати міць ВМС 🇺🇦  Триває активна розбудова військово-морських баз, навчальних закладів, облаштування місць постійної дислокації бойових частин ВМС, розвиток об’єктів національного флоту й надходження нового озброєння та військової техніки.  https://t.co/9CvpymEAQ4",Сентенція,4
04.07.2020 17:25:04,"Наша перлина біля моря. Солоне повітря, чиста вода, крики чайок і люди, які вміють ставити мету й наполегливо йти до неї. Привіт, Одещино, колоритна й гостинна! #МандруйУкраїною  https://t.co/77zLXrYMKJ",Сентенція,4
03.07.2020 17:54:43,Олена здолала #COVID19! Нарешті сьогодні ввечері вся родина буде за одним столом.,Вшанування,7
03.07.2020 15:50:42,"Подякував @GiuseppeConteIT за обладнання для відновлення Прикарпаття, постраждалого від стихії, й за швидке рішення про гуманітарну допомогу та її доставку. Радію, що українські лікарі допомогли Італії боротися з #COVID19. Це приклади дружби між #Україна 🇺🇦 та #Італія 🇮🇹  https://t.co/RkFvumQdfb",Сентенція,4
28.06.2020 10:51:21,"Що для мене берегти Україну? Це берегти кожного українця.    І саме конституційні права громадянина є підказкою, як це робити. Ми маємо навчитись поважати права одне одного.   https://t.co/3Z3MRyqcfz",Сентенція,4
27.06.2020 18:16:46,"Відвідав синагогу Хабад на Херсонщині, яку у квітні зловмисники намагалися підпалити. Дякую правоохоронцям за швидке розкриття злочину. В Україні низький рівень антисемітизму, кожна людина, незважаючи на національність чи  віросповідання, може почуватися безпечно в нашій країні.  https://t.co/zhO6EuzrAn",Вдячність,3
26.06.2020 20:55:04,"На виноробні князя Трубецького зустрівся з аграріями. Відстоюватиму їхні інтереси, працюватиму над захистом їхніх прав, над тим, щоб вони мали можливості для розвитку в Україні й для експорту, а їхня продукція не поступалася імпортній. Херсонщино, дякую й до наступного побачення!  https://t.co/44Q35Tk0c3",Подія,5
26.06.2020 20:53:47,З допомогою Нацполіції та СБУ ми будемо затримувати фури та змушувати їх розвантажуватись. Ми зшиваємо Україну новими дорогами й не дамо їх руйнувати.  https://t.co/kilkEnXLhH,Невдоволення,1
26.06.2020 20:51:50,"Радий, що на Херсонщині активно триває «Велике будівництво». Хоча шкода, що останнє десятиріччя було втрачене: з 2010-го по 2020-й сумарно грошей і кілометрів доріг було менше, ніж ми будуємо цьогоріч. А будувати є що: потрібні й садочки, і школи, і стадіони.  https://t.co/mCOjbGvpZR",Вшанування,7
26.06.2020 20:50:17,"Сьогодні ми дали старт концесії в Україні! Інвестиції, що були лише на папері, ставатимуть новими дорогами, сучасними портами, робочими місцями. Херсон отримає сотні мільйонів гривень інвестицій у розвиток морського порту та інфраструктури міста й регіону в найближчі 3 роки.  https://t.co/Ez7IstJc7L",Підтримка,6
24.06.2020 17:48:15,"З 1 липня деякі авіарейси між Туреччиною та Україною будуть відновлені. Згоден з @RTErdogan, що це дасть поштовх для відновлення туристичної галузі. Дякую за гуманітарну допомогу. Ми поглиблюємо стратегічне партнерство між 🇺🇦 і 🇹🇷 на всіх напрямах, що становлять спільний інтерес.  https://t.co/pHq5O1avZT",Сентенція,4
19.06.2020 15:02:30,"Вітаю екіпаж танкера «Рута» на батьківщині. Хлопці, ви пройшли нелегке випробування. Спільними зусиллями ми зробили так, що воно вже позаду. Радий за кожного з вас і за ваші родини!  https://t.co/38VbNG1XKb",Вшанування,7
19.06.2020 09:47:11,"Завжди почуваюся впевнено та безпечно на борту Ан-148 та Ан-74. Саме ці літаки входять в авіапарк українського Президента. Вони поєднують унікальні знання та досвід українських авіаконструкторів. Відчуваю гордість за наш авіапром щоразу, коли піднімаюся на борт цих красенів.  https://t.co/yIumkeK0ww",Вшанування,7
18.06.2020 19:43:13,Пандемія #COVID19 не має стати причиною закриття кордонів #ЄС для громадян держав-партнерів. Зараз – найкращий час говорити про підписання угод про створення спільного авіаційного простору та про зменшення плати за послуги роумінгу #EasternPartnership,Сентенція,4
18.06.2020 19:31:35,"Стабільне безпекове середовище, фундаментом якого є суверенітет і територіальна цілісність, – головна передумова для реалізації цілей Східного партнерства. Це – зміцнення демократії, впровадження реформ, верховенство права та повага до прав і свобод людини #StrongerTogether",Сентенція,4
18.06.2020 19:17:21,"Східне партнерство не має обмежувати амбіції. Комусь достатньо політичного діалогу, комусь – стратегічного партнерства з #ЄС, хтось прагне інтеграції до спільного ринку на основі «чотирьох свобод», а хтось, як #Україна, вимагає повноправного членства в ЄС #EasternPartnership  https://t.co/zaRYQbcA4M",Сентенція,4
15.06.2020 18:48:57,Подякував @JustinTrudeau за гуманітарну допомогу 🇨🇦 по лінії Гуманітарного фонду #ООН розміром 500 тис. канадських доларів для протидії захворюванню в 🇺🇦. #Україна та #Канада завжди стоять пліч-о-пліч на міжнародній арені. Обов'язково передам Олені слова підтримки!  https://t.co/lHz3t98WYh,Вдячність,3
15.06.2020 18:34:14,"Радий, що @JustinTrudeau погоджується, що нам треба працювати над переглядом візового режиму для України для його спрощення. Джастіне, був радий чути. Що менше перешкод між нашими людьми, то міцніша дружба між 🇺🇦 та 🇨🇦  https://t.co/WH4lW0g1J2",Вдячність,3
13.06.2020 12:49:23,"Шість років з того історичного дня, коли Маріуполь було звільнено від окупантів і над містом знову замайорів український прапор.   Цей день є наочним доказом простої істини: коли ми, українці, об’єднані, для нас не існує нічого неможливого.  https://t.co/XXtau7nFX9",Вшанування,7
12.06.2020 17:50:22,"Вдячний членам Альянсу за визнання вагомого внеску України в спільні операції з підтримання миру у світі. Статус Партнера розширених можливостей НАТО – практичне рішення, яке дозволить Україні та Альянсу ще краще взаємодіяти заради спільної безпеки.",Вдячність,3
12.06.2020 15:20:57,".@SwedishPM підтримав мою пропозицію повернути питання Криму на порядок денний. Впродовж років звучало лише питання припинення війни на Донбасі. Однак війна, яка там триває, почалася саме з Криму. #Крим 🇺🇦",Підтримка,6
12.06.2020 15:19:30,"У нас зі @SwedishPM спільні погляди на європейське майбутнє України. На відеоконференції лідерів Східного партнерства відстоюватиму фіксацію європейських перспектив для асоційованих партнерів, підтримку територіальної цілісності партнерів, подальшу інтеграцію ринків з #ЄС.",Підтримка,6
10.06.2020 18:35:53,"Прогулявся Черніговом. Які ж гостинні та щирі усмішки! Дякую, що поділилися: і хорошим настроєм, і проблемами. Все, що почув, вирішуватимемо, а гарного настрою багато не буває!  https://t.co/ae8Sbk4S75",Вшанування,7
10.06.2020 16:41:30,"Кажуть, Чернігів – місто легенд. Дійсно – містичне, красиве й неймовірно привабливе. Справжній магніт для туристів!  https://t.co/FTAIHFiCNo",Вшанування,7
10.06.2020 15:27:28,"#Україна отримала другий транш у межах Четвертої програми макрофінансової допомоги від Європейської комісії @EU_Commission у розмірі €500 млн. Ці кошти допоможуть зменшити боргове навантаження та подолати негативні економічні наслідки, спричинені пандемією #COVID19",Вдячність,3
10.06.2020 00:19:35,"#Україна отримає перший транш від #МВФ у розмірі $2,1 млрд. Це на $200 млн більше, ніж планувалося спочатку. Нова програма допоможе подолати виклики, спричинені #COVID19. У складний час МВФ доводить, що є надійним партнером.",Сентенція,4
07.06.2020 09:05:10,"Вітаю з днем Святої Трійці. Вірю – сьогодні всі ми дотримаємося старовинного народного звичаю: не будемо сваритися, тримати на когось зла й заздрити. Бо тільки з чистою душею й серцем, без зла, образ і лихих думок ми з вами зможемо зробити нашу країну кращою.  https://t.co/CzCsJoetvs",Вшанування,7
06.06.2020 15:59:50,"За перший рік президентства сповна відчув гостроту пера журналістів, але не припиню вас поважати й захищати. І надалі відповідатиму на ваші запитання. Навіть у несподіваних місцях та умовах! Як-от за кермом велосипеда. Сил і натхнення вам, шановні журналісти! Зі святом!  https://t.co/GsUke0vqVO",Вшанування,7
05.06.2020 18:07:05,"Обіцяв @Pontifex передати вітання українському народу, до якого Папа почувається «близьким серцем». Його Святість опікується питанням звільнення українського військовослужбовця Віталія Марківа. Його підтримка єдності, солідарності та відкритості Європи є надважливою для України.  https://t.co/cmm2Xzuzr9",Вшанування,7
05.06.2020 16:56:20,Олена зробила рестарт дуже крутого проекту – тепер українська мова звучатиме в одному з найбільших музеїв Австрії! З її ініціативи у художній галереї Альбертіна з’явився україномовний аудіогід.  https://t.co/40a2NbfZPK,Вшанування,7
05.06.2020 16:45:59,"Ангела Меркель – справжній друг України. У телефонній розмові ми підтвердили необхідність послідовної імплементації всіх домовленостей, досягнутих на саміті «Нормандської четвірки» в Парижі. Їхнє ефективне виконання прокладе шлях до саміту в Берліні.  https://t.co/GI0XeT2lmF",Подія,5
04.06.2020 15:59:02,"Щоб влучити, треба гарно прицілитися. У Кам’янці вирішили піднімати український туризм. Прицілився добре!  https://t.co/P7AfGGnh9m",Сентенція,4
03.06.2020 19:28:37,"Крута кава у Хмельницькому! Ароматна і смачна! Перші кафе виходять з карантину, оговтуємося потихеньку від коронавірусної епідемії.  https://t.co/pLnbqO7lHB",Сентенція,4
03.06.2020 16:54:15,"У Давидківцях на Хмельниччині отримав від людей книгу з історією цього села. Нині ми, українці, створюємо наше майбутнє – в столиці і в регіонах, у містах і селах. Кожен – на своєму місці. Ми зробимо все, щоб у продовженні цієї книги-історії було більше радісних сторінок.  https://t.co/ue7HxQLbCG",Сентенція,4
02.06.2020 17:02:37,"Зустрівся з керівниками провідних закладів вищої освіти. Вперше з 2005 року ректори зібралися з Президентом у такому форматі. Українська вища освіта має вирішити питання кадрового голоду та зробити нашу країну успішною, а ми разом повинні знайти ефективні інструменти для цього.  https://t.co/k8pVBV07mh",Подія,5
01.06.2020 19:10:18,"Діти надихають нас робити світ кращим. У деяких наших дітей, особливо тих, хто належить до вразливих груп, є багато проблем. Нам потрібно більше програм з @UNICEF, і ми повинні докладати більше зусиль, щоб подарувати українській малечі щасливе дитинство, на яке вона заслуговує.  https://t.co/7OHxfGF4XS",Сентенція,4
01.06.2020 19:08:33,"Обговорив з @UNICEF стратегії покращення соціального захисту дітей. Діти – це наше майбутнє, яким ми ризикуємо, якщо не захистимо їх належним чином.  https://t.co/3qBKV8gPZQ",Сентенція,4
01.06.2020 12:52:42,"Упевнений, що День захисту дітей – це не тільки 1 червня. Це має бути кожен день нашого життя. Давайте пам’ятати, що чужих дітей не буває.  https://t.co/9rqbaa8y0u",Вшанування,7
31.05.2020 10:53:42,"Бажаю Києву й Кривому Рогу бути здоровими: у питаннях комфорту, безпеки, затишку та дозвілля. Мати міцний імунітет від «вірусу поганих доріг», тримати дистанцію від заторів і хаотичної забудови! Одержувати заряд від івентів, змагань і масштабних інвестицій. Квітнути тисячі років!",Вшанування,7
29.05.2020 20:29:44,Подякував @KGeorgieva за стабільне партнерство та конструктивний діалог. Затвердження Радою директорів @IMFNews програми співпраці з Україною відбудеться найближчим часом.,Сентенція,4
