created_at,tweet,Категорія,Категорія_Ід
08.02.2021 10:24:49,"Перший етап вакцинації проти #COVID19 якісною вакциною почнеться цього місяця. Її отримають медики, військові, нацгвардійці. Програма передбачає охоплення щонайменше половини населення #Ukraine протягом 21-го та початку 22-го року #Ukraine30_covid #forum_ukraine30",Сентенція,4
08.02.2021 10:20:24,"У протидії #COVID19 #Україні є чим пишатися. Рівень смертності від COVID-19  у нас нижчий, ніж у багатьох країнах #Європи. Нам вдалося втричі зменшити середньотижневу кількість випадків захворювання й почати відновлювати нашу медицину #covid19_Україна  #forum_ukraine30",Сентенція,4
06.02.2021 16:44:37,"Навіть @Google повідомив світові, що українській антарктичній станції «Академік Вернадський» – 25! Мав нагоду поговорити з командою та побажати успіху! Їхня історія – це історія ентузіазму й відданості науці заради нашого спільного безпечного майбутнього #Vernadsky #ClimateAction  https://t.co/iXDKM5RSbD",Вшанування,7
02.02.2021 16:32:13,"Радий, що @harari_yuval сьогодні буде на @yes_ukraine. Людство має подолати не лише #COVID19, а й «своїх внутрішніх демонів, ненависть, жадобу та неуцтво». Нам слід подолати страхи та об’єднатися. Вітаю дискусію про те, як відновити світову солідарність #YESOnlineConversation  https://t.co/w9XjkFmIWJ",Підтримка,6
29.01.2021 16:11:18,"Швидке постачання вакцини стане сильним політичним сигналом підтримки 🇺🇦 від #Євросоюзу у протидії #COVID19. Про це говорив з головою @EU_Commission @vonderleyen. Згоден, що ми маємо вчитися на кризових ситуаціях і протистояти їм разом.",Сентенція,4
28.01.2021 13:18:37,"Енергетика, інфраструктура, цифровізація, кібербезпека – в #України 🇺🇦 чимало сфер для співпраці з Іспанією 🇪🇸. Радий спілкуванню з @sanchezcastejon, наше порозуміння – крок до теплих та ефективних відносин двох країн. Бажаю здоров’я! Буду радий бачити в Україні!",Сентенція,4
27.01.2021 16:47:13,"Вітаю створення українсько-канадської робочої групи з питань мобільності. Впевнений, цей новий інструмент сприятиме активізації двостороннього діалогу 🇺🇦 та 🇨🇦 з питань міграції та спрощенню режиму поїздок українців до Канади.",Сентенція,4
25.01.2021 13:15:08,Щиро вітаю Марселу Ребелу де Соузу з переобранням на посаду Президента Португалії. У розвиток нашої нещодавньої телефонної розмови налаштований на подальше поглиблення співпраці між 🇺🇦 та 🇵🇹. Очікую на нашу майбутню зустріч.,Вшанування,7
22.01.2021 19:18:24,"Радий першим привітати @ArminLaschet після підтвердження результатів виборів. Для 🇺🇦 важливо знати, що ми можемо покладатися на спадкоємність політики 🇩🇪, особливо в питанні досягнення миру на #Донбасі. Наші країни й надалі мають розвивати співпрацю та поглиблювати партнерство.",Вшанування,7
22.01.2021 09:05:00,"Бережімо нашу Україну і будьмо єдині. І в радості. І в горі. І нехай води красеня Дніпра будуть єдиним, що розділяє нас.  З Днем Соборності, великий та сильний народе!",Вшанування,7
21.01.2021 16:35:14,"15 загиблих та 5 постраждалих. Молимося, щоб не було більше. Дав доручення терміново створити Державну комісію для з’ясування причин трагедії. Закликаю місцеву владу зробити все можливе для допомоги постраждалим і родичам, які втратили своїх близьких. Мої щирі співчуття.  https://t.co/hayY1jlfQn",Співчуття,2
19.01.2021 17:49:02,"Радий вітати @AnnLinde на посаді діючої голови ОБСЄ. Ваш приїзд до України свідчить про важливе значення, яке шведське головування надаватиме питанню відновлення суверенітету й територіальної цілісності України, встановленню миру та дотриманню безпеки у Європі.  https://t.co/WWw7rk8d9y",Вшанування,7
16.01.2021 13:39:10,Щиро вітаю @ArminLaschet з упевненою перемогою на виборах голови партії @CDU! Зичу успіхів у вашій праці заради процвітання Німеччини. Сподіваюся на подальше зміцнення та поглиблення українсько-німецького партнерства на благо наших народів.,Вшанування,7
15.01.2021 16:38:28,Радий поспілкуватися з Ангелою #Меркель. Бажаю міцного здоров’я кожному громадянину Німеччини в часи пандемії #COVID19. 🇩🇪 завжди залишається для 🇺🇦 надійним другом і партнером. Продовжуємо координувати наші зусилля задля встановлення миру на #Донбасі.,Подія,5
14.01.2021 18:39:02,Банкова. Нарешті зима. 14 січня. Ось тепер вже точно – З НОВИМ РОКОМ!!!  https://t.co/QPiJcIGpGL,Вшанування,7
13.01.2021 15:33:08,"Радий розмові з Marcelo Rebelo de #Sousa. Obrigado за підтримку євроінтеграційних прагнень України. 🇺🇦 та 🇵🇹 – європейські країни. У нас багато тем для співпраці: торгівля, енергетика, космос, діджиталізація. Чекаю на особисту зустріч.",Подія,5
12.01.2021 13:33:32,Головною складовою діалогу між 🇺🇦 та 🇲🇩 завжди будуть наші громадяни. Актуальним завданням є забезпечення прав української національної меншини в Молдові та молдовської – в Україні. Дякую @sandumaiamd за відкритість і готовність до співпраці заради розвитку наших країн.  https://t.co/1CWYiix9wh,Вдячність,3
12.01.2021 11:44:25,"Вітаю @sandumaiamd у Києві. Це початок нових відносин 🇺🇦 та 🇲🇩. Нас єднають спільні цінності та позиції щодо питань загальноєвропейського порядку денного. Ми цінуємо, що Президент 🇲🇩 підтримує суверенітет і територіальну цілісність 🇺🇦, не боїться називати Крим українським.  https://t.co/hFsOuMTRHE",Подія,5
06.01.2021 19:04:13,"Магія Різдва особлива. Обійняти кохану та дітей, побути з друзями. Різдво дарує нам найцінніше – любов і світлу надію.  https://t.co/A2mlYtczS6",Вшанування,7
06.01.2021 18:04:11,"Щиро вітаю мільйони українських родин зі святом Різдва Христового. Не існує кращого дня, щоб порозумітися між собою, тож нехай радість і тепло цього свята об’єднають нашу країну.  https://t.co/nOnvEvOoTL",Вшанування,7
31.12.2020 23:47:33,"Ви запитаєте, чи був важким 2020-й? Трішечки так. Але ми не маємо іншого варіанту, аніж стати найсильнішою країною. Я щиро вітаю всіх українців з Новим роком! Нехай усі будуть здорові, нехай усі будуть щасливі!   https://t.co/kNoYGDWYS6",Вшанування,7
30.12.2020 16:41:23,Солодощі зі Слов’янська. Подарунок з душею. Донбас – це Україна! 🇺🇦  https://t.co/NyaqqvXLjD,Сентенція,4
24.12.2020 18:21:30,"Запорізький міст. Перша черга. ХОТІЛИ збудувати ще в 1965, а ми ЗМОГЛИ у 2020🇺🇦  https://t.co/drx69ssM8D",Вшанування,7
22.12.2020 21:02:54,Дякую @EmmanuelMacron за готовність допомогти з прискоренням надання вакцини проти #COVID19. Це жест справжньої дружби. Ціную підтримку Францією суверенітету й територіальної цілісності 🇺🇦 та наших мирних ініціатив. #ACTogether,Вдячність,3
18.12.2020 14:42:19,"Радий вітати в 🇺🇦 @MevlutCavusoglu, #HulusiAkar. Готуємося до чергового засідання Стратегічної ради високого рівня на початку 2021 року. Вдячний за підтримку 🇹🇷 територіальної цілісності та суверенітету #України. Буду радий побачитися з @RTErdogan у Києві.  https://t.co/xwiRn8YkbI",Вдячність,3
16.12.2020 08:36:36,6-Б з Вербки на Волині цьогоріч першим надіслав новорічні привітання. Від них затишно й тепло на душі. Усі побажання взаємні! Я обов’язково завітаю ще!  https://t.co/UfEPk4Ggk1,Вдячність,3
13.12.2020 09:07:48,"Виступив на #ClimateAction Summit 🇺🇳 🇬🇧 🇫🇷. 🇺🇦 пишається своєю роллю у вирішенні глобальних кліматичних проблем. Ставимо мету узгоджувати нашу політику з #EUGreenDeal, працювати над #NetZero й адаптаційним планом, зменшити викиди на 58-64% до 2030-го у порівнянні з 1990-м. #COP26",Подія,5
12.12.2020 11:13:25,Вже не дочекаюся 🇺🇦-🇨🇦 шедеврів! Вітаю ратифікацію Угоди про спільне аудіовізуальне виробництво між Україною та Канадою. Про це ми домовилися торік з моїм другом @JustinTrudeau. Вона відкриває можливості для 🇺🇦 та 🇨🇦 митців!  https://t.co/B1iFdvgV0X,Сентенція,4
11.12.2020 15:30:06,"Вдячний @VeniceComm та @giannibuquicch1 за рішення щодо КСУ. 2 схвалені документи дають важливі орієнтири, як уникнути невідворотної шкоди антикорупційній реформі й реформувати КС, щоб нинішня ситуація не повторилась. Позиції Комісії врахують при підготовці судової реформи в 🇺🇦.  https://t.co/c27IWRmJbU",Вдячність,3
10.12.2020 14:58:05,"Щасливої Хануки 🕎, свята світла та чудес! Найщиріші вітання євреям усього світу! Хай дух веселих свят супроводжує вас протягом усього наступного року та приносить мир і радість у кожен дім. Бажаю, щоб магія Хануки ніколи не закінчувалася, як і її дари.  https://t.co/NBsyrOfcSm",Вшанування,7
09.12.2020 13:27:29,Вдячний нашим партнерам у #ЄС та особисто Президенту ЄК @vonderleyen і виконавчому віце-президенту @Vdombrovskis за надання #Україні макрофінансової допомоги в розмірі 600 млн євро. Це вагомий сигнал підтримки 🇪🇺 економічної стабільності 🇺🇦 та подальшого курсу реформ в #Україні,Вдячність,3
09.12.2020 08:48:44,"Шлях до миру нелегкий, але знаю – ми зможемо.  https://t.co/EK6kPRB9xX",Сентенція,4
07.12.2020 14:22:03,"Дякую @GitanasNauseda, що піднімаєте в #ЄС питання надання вакцини проти #COVID19 для країн – членів Східного партнерства. Україна рада провести Конференцію з реформ у Вільнюсі в липні 2021 року. Чекаємо на пана Науседу та пані Науседене з візитом в Україні!",Вдячність,3
06.12.2020 10:08:26,"Дякую захисникам України за службу й вітаю всіх з Днем Збройних сил! Зі святом тих, хто щоденно дарує нам вільне життя. Слава Україні!",Вшанування,7
05.12.2020 16:51:34,"Сьогодні ми кажемо слова подяки кожному з волонтерів, які долучилися до допомоги армії та державі. Наша країна базується саме на народному прагненні до самостійності, а український волонтерський рух відображає це прагнення найочевидніше.  Дякую кожному з вас! І слава Україні!  https://t.co/4tVdNhLG8b",Вшанування,7
03.12.2020 10:35:12,"Сьогодні додому повертаються наші молоді боксери. З чемпіонату Європи вони везуть 20 медалей: 5 золотих 🥇, 4 срібних 🥈та 11 бронзових 🥉. Це – найкращий результат в історії юніорської збірної з боксу за роки незалежності 🇺🇦 Наші чемпіони, #Україна пишається вами! 🏆  https://t.co/y2fA7KQJCc",Вшанування,7
28.11.2020 10:58:41,"Сьогодні, о 16-й годині запаліть у своїх вікнах свічки пам’яті. Нехай вони зігріють своїм теплом душі безневинних жертв голодоморів.  https://t.co/XtPsavxq7b",Співчуття,2
26.11.2020 08:30:54,"У Києві стартує 36-й чемпіонат Європи з художньої гімнастики. Такі події дуже важливі, адже вони об’єднують, дають змогу порадіти за своїх, заряджають позитивом. Бажаю успіху кожній учасниці! #UkraineNow #Kyiv2020Rg #ech2020 #kyiv2020 #rhythmiceuropeans #YouMakeThisWorldGlow  https://t.co/e9kJ8Gc6EH",Підтримка,6
24.11.2020 10:52:37,"ЗВТ між Україною та Ізраїлем почне діяти вже з 1.01.2021! Це новий рівень відносин між країнами та зелене світло для збільшення українського експорту, тіснішої кооперації у сферах high-tech, інжинірингу, розвитку інвестиційної співпраці. Чудова новина, @netanyahu!",Вшанування,7
23.11.2020 12:43:07,"Дякую за побажання швидкого одужання @vonderleyen @WHNSC @JustinTrudeau @vanderbellen @AndrzejDuda @moonriver365 @presidentaz @TokayevKZ @netanyahu @MattiMaasikas @StewartMcDonald @JJansaSDS. І всім, від кого надійшли теплі слова. Міжнародна підтримка – потужні ліки від #COVID19",Вдячність,3
21.11.2020 10:16:34,"Погляньмо, у яку Україну вірить наша молодь! Якщо тобі до 30 чи й 30, надсилай відео про те, що ти робиш для майбутнього нашої держави, на  https://t.co/oL4QaAujl4. Там – усі деталі. Із десятьма переможцями побачимося на День Незалежності, у 30-ту річницю України!  https://t.co/ywBgAens83",Підтримка,6
21.11.2020 09:08:47,"Ми маємо продовжувати нелегке будівництво дійсно нової України – вільної та гідної. України, де на першому місці завжди буде закон, а не прізвища чи колишні заслуги.  З Днем Гідності та Свободи вас!    https://t.co/TwzHhS7Bkr",Вшанування,7
20.11.2020 16:24:15,".@giannibuquicch1 глибоко розуміє ситуацію з КСУ. Важливо відновити довіру суспільства до конституційного судочинства. Маємо активізувати напрацювання збалансованого комплексного рішення для швидкого розв’язання кризи. Спільно ми знайдемо шлях, що відповідатиме верховенству права",Сентенція,4
17.11.2020 22:47:22,"Радий обговорити з @KGeorgieva просування до ухвалення бюджету, збереження антикорупційного порядку денного та макроекономічної стабільності 🇺🇦. Наші команди мають міцну довіру й тісно працюють, щоб якнайшвидше прийняти місію @IMFNews",Сентенція,4
16.11.2020 20:11:05,Сьогодні спільно з Національною комісією у справах @UNESCO я запускаю міжнародний флешмоб відеопривітань з нагоди 75-річчя організації. Долучайтеся!   https://t.co/1Kx62tQbos,Підтримка,6
16.11.2020 09:28:29,Почав ранок з гарної телефонної розмови з Маєю Санду. Привітав її з перемогою на виборах Президента Молдови. Упевнений у подальшому зміцненні відносин між Україною та Молдовою і європейській інтеграції наших народів 🇺🇦 🇪🇺 🇲🇩. З нетерпінням очікую на візит колеги до Києва.,Подія,5
16.11.2020 08:18:48,Вітаю @sandumaiamd з перемогою на президентських виборах у Молдові. З нетерпінням очікую на подальше зміцнення відносин між Україною 🇺🇦 та Молдовою 🇲🇩 задля європейського майбутнього наших народів.,Вшанування,7
11.11.2020 08:42:01,"Щирі вітання @AndrzejDuda з Днем незалежності Польщі! Бажаємо братньому польському народу миру та злагоди. Цінуємо підтримку 🇵🇱 у відстоюванні територіальної цілісності 🇺🇦. Впевнений, стратегічне партнерство між 🇺🇦 та 🇵🇱 сприятиме зміцненню миру, стабільності та безпеки у Європі.  https://t.co/m4iB69kE0s",Вшанування,7
10.11.2020 16:24:00,Був радий чути канцлера Меркель. Україна вдячна Німеччині та Франції за підтримку наших мирних ініціатив. Важливо продовжити переговори в N4. Бажаю німецькому народу сил для подолання #COVID19.,Вдячність,3
09.11.2020 17:13:02,"Немає у світі щасливчиків, для кого б #COVID19 не становив загрози. Попри усі карантинні заходи, я теж отримав + результат. В мене 37,5, а всім бажаю 36,6! Втім, почуваюся добре. Обіцяю ізолюватися і продовжую працювати. Більшість долає COVID19. І я теж це пройду. Все буде добре!",Сентенція,4
07.11.2020 09:18:08,"🇺🇦 отримає від @WorldBank $100 млн на відновлення економіки та підприємництва підконтрольних територій на сході. Дякую @DavidMalpassWBG та @ArupBanerji за підтримку територіальної цілісності 🇺🇦. Ми зробимо все, щоб наші громадяни почувалися в безпеці, а регіони ставали заможними.",Вдячність,3
06.11.2020 18:33:00,"Вдячний усім іноземним гостям за те, що приїхали на #Донбас. Тільки тут можна побачити справжнє обличчя війни й відчути, наскільки люди хочуть миру. Об’єднана, мирна, сильна #Україна – наша мета і наш справжній план.",Вдячність,3
06.11.2020 15:05:22,"Як казав Михайло Жванецький, нічого страшного, якщо над тобою сміються. Значно гірше, коли над тобою плачуть. Сьогодні такий гіркий день. Співчуття всім, хто його любив і знав. Я – серед палких шанувальників сили думки Михайла Михайловича. Його сатира стала для багатьох мудрістю.",Співчуття,2
05.11.2020 23:58:40,"Радий, що @EmmanuelMacron погоджується, що зустріч #N4 треба провести якнайшвидше. Україна неухильно виконує Паризькі домовленості та вже готова відкрити 2 КПВВ на лінії розмежування.",Сентенція,4
05.11.2020 22:34:18,"Радий поспілкуватися з @BradSmi. Ми дійсно цифровізуємо країну, щоб держава була комфортним сервісом для людей. Разом з президентом @Microsoft ми працюватимемо для захисту демократії, боротьби з корупцією та приваблення інвестицій.  https://t.co/9S23P2qLOM",Сентенція,4
04.11.2020 18:32:45,"Схвалюю наміри @jairbolsonaro щодо того, що наша майбутня зустріч мала б закінчитися підписанням двосторонніх документів. Україна рада співпраці з Бразилією у сільському господарстві, ядерній енергетиці, космічній і військово-оборонній сферах.",Підтримка,6
